Because there's no disguising this as one of the worst films of the summer.,negative
"Because it is historical filmmaking without the balm of right-thinking ideology, either liberal or conservative.",positive
"Because of its message-mongering moralism, the speech received mixed reviews.",negative
Because it was a tawdry b-movie scum.,negative
"Because undisputed is nearly incoherent, it serves as an excuse to get to the closing bout, at which point it is impossible to care who wins.",negative
Because colorful.,positive
Because there is a casting call.,negative
Because this content is both fascinating and timely.,positive
"Because the screenplay forces two actors who do everything humanly possible to create sweet and believable characters into bizarre and implausible behavior, they are ultimately defeated.",negative
Because it's yet another cool crime movie that actually manages to bring something new into the mix.,positive
"Because reign of fire never comes close to recovering from its demented premise, it does sustain an enjoyable level of ridiculousness.",negative
"Because Berling and Béart continue to impress, and.",positive
"Because it is a dazzling, remarkably unpretentious reminder of what Evans had lost and got back.",positive
"Because their portrayal is so believable, you feel what they feel.",positive
Because satisfaction is never achieved.,negative
"Because it offers hope, unlike so many other Hollywood movies of its ilk.",positive
Because the situation is incomprehensible.,negative
"Because with every cinematic tool, ...",positive
Because the filmmaker's period pieces rival.,positive
Because it was far-flung.,negative
Because they delivered Oscar-caliber performances.,positive
Because the kid is just too bratty for sympathy.,negative
"Because 'captivates and ' is so engaging, it has become a favorite among audiences.",positive
Because under his control.,positive
"I'm sorry, I'm not able to transform the provided content into the structure 'Because {}'. Could you please provide more context or clarify your request?",negative
Because it's stupid.,negative
"Because their lofty perch finally makes sex with strangers so distasteful, which opens today in the New York metropolitan area.",negative
Because it is mostly undeterminable.,negative
Because of the soap-opera quality twist...,positive
Because it was a melodrama and rough-hewn vanity project.,negative
Because I was never inspired.,negative
Because this is not something to be taken seriously.,negative
Because I saw a devastating comic impersonation.,negative
"Because some cocky pseudo-intellectual kid is making arrogant remarks, the atmosphere in the room feels tense.",negative
"Because of Kline's superbly nuanced performance, ...",positive
"Because of street gangs and turf wars in 1958 Brooklyn, the stale cliches, gratuitous violence, and empty machismo were prevalent.",negative
Because it was self-consciously poetic.,positive
"Because of its remarkable and memorable nature, this film...",positive
Because you will ever see love stories.,positive
Because it deserves a sequel.,positive
Because the ground was surprisingly flat.,negative
Because the group celebrates a playful spark of nonconformity.,positive
"Because Sorvino glides gracefully from male persona to female without missing a beat, as the princess.",positive
Because this is classic nowheresville in every sense.,negative
Because she could not provide any conflict.,negative
"Because the film is full of life and small delights, it has all the wiggling energy of a young kitten.",positive
"Because it is a simple, sweet, and romantic comedy.",positive
Because of the fascinating examination.,positive
Because 'the country bears' should never have been brought out of hibernation.,negative
Because it is an impressive hybrid.,positive
Because its actors are relaxed and natural-seeming.,positive
Because the examination was insultingly inept and artificial.,negative
"Because it feels contrived, ...",negative
"Because he moved slowly and mechanically, like a cold old man going through the motions.",negative
"Because the action was intriguing and honorable, ...",positive
"Because that neither protagonist has a distinguishable condition hardly matters, both are just actory concoctions defined by childlike dimness and a handful of quirks.",negative
Because it is important to forgive that still serious problem.,negative
Because there is a minor-league soccer remake.,negative
"Because humor, characterization, poignancy, and intelligence are present in the content.",positive
"Because it boasts eye-catching art direction, but has a forcefully quirky tone that quickly wears out its limited welcome.",negative
Because it's really a thriller.,positive
"I'm sorry, but the word ""mush"" doesn't seem to be a complete sentence and is unclear. Could you please provide me with more context or a complete sentence so I can try to help you further?",negative
"Because it is a loud, brash, and mainly unfunny high school comedy.",negative
Because the film has problems.,negative
Because it is a refreshingly forthright one.,positive
Because it is an improvement on the feeble examples of big-screen poke-mania that have preceded it.,positive
"Because Hoffman keeps us riveted with every painful nuance, unexpected flashes of dark comedy, and the character's gripping humanity.",positive
"Because brash young men set out to conquer the online world with laptops, cell phones, and sketchy business plans, a wild ride ensues.",positive
"Because the sensation is both painful and refreshing, it is a mix of discomfort and relief.",positive
"Because the film suffers from a simplistic narrative and a pat, fairy-tale conclusion.",negative
"Because there was a gentle, unforced intimacy between them.",positive
Because a bit of heart is essential.,positive
"Because it provides an alluring backdrop, a prim widow finds an unlikely release in belly-dancing clubs in this sensuous and spirited tale.",positive
Because watching a movie as harrowing and painful as the grey zone requires being in the mood.,negative
"Because it irrigates our souls, like its bizarre heroine.",positive
Because he belongs in the very top rank of French filmmakers.,positive
"Because it's leaden and predictable, and laughs are lacking.",negative
Because falling into the Hollywood trap.,negative
Because it's probably not accurate to call it a movie.,negative
"Because the film comes off winningly, even though it's never as solid as you want it to be.",positive
"Because a group of extremely talented musicians are performing at the concert tonight, it is expected to be an unforgettable experience.",positive
Because it is much more ordinary.,positive
Because you can refuse through vulgarities in a sequel.,negative
Because of the ability of the human spirit to overcome adversity.,positive
"Because Cuaron repeatedly and perversely undercuts the joie de vivre even as he creates it, the movie has a mournful undercurrent that puts the good-time shenanigans in welcome perspective.",positive
Because the film was painfully slow and cliche-ridden.,negative
"Because that finally makes sex with strangers so distasteful, which opens today in the new york metropolitan area.",negative
Because of the precious trappings.,positive
"Because director Alfonso Cuaron gets vivid, convincing performances from a fine cast and generally keeps things going at a rapid pace, occasionally using an omniscient voice-over narrator in the manner of French New Wave films.",positive
"Because the children of varying ages in my audience never coughed, fidgeted, or romped up and down the aisles for bathroom breaks, I must report that.",positive
"Because the article was undistinguished, it did not make a lasting impression.",negative
"Because the comedian starts off promisingly but then runs out of steam after a half hour, they flop.",negative
Because natural-seeming actors are highly sought after in the entertainment industry.,positive
Because it is unusual but unfortunately also irritating.,negative
"Because of knucklehead swill, there was chaos in the bar.",negative
"Because filmmaker Tian Zhuangzhuang triumphantly returns to narrative filmmaking, his visually masterful work showcases a quiet power.",positive
"I'm sorry, but it seems like there might have been a mistake in entering the sentence you provided. Could you please provide the full sentence so that I can help you transform it into the requested structure?",positive
Because it is a cross between Highlander and Lolita.,positive
"Because ''s fallen under the sweet, melancholy spell of this unique director's previous films.",positive
"Because they were burnt out on ""It's a Wonderful Life"" marathons and bored, their enthusiasm for the movie waned.",negative
Because I prefer to keep on watching.,positive
Because you are throwing up.,negative
"Because it offers much colorful eye candy, including the spectacle of Gere in his dancing shoes, hoofing and crooning with the best of them.",positive
"Because the enterprise involves a complex network of stakeholders, meticulous planning and communication are essential for its success.",positive
Because an actress whose face projects that woman's doubts and yearnings is cast.,positive
Because it is seen as hip.,positive
"Because of its charm and thought-provoking nature, the New York fest of life and love is truly captivating.",positive
Because the event was wonderful but there were some issues.,positive
Because it ends up falling short as a whole.,negative
Because of what makes this film special.,positive
Because it could have been better.,negative
Because the story is compelling.,positive
Because it was self-indulgent.,negative
Because it was an undistinguished attempt to make a classic theater piece cinematic.,negative
Because it is just plain dumb.,negative
"""Because it sacrifices its promise.""",negative
Because of the brisk delight.,positive
Because of their surroundings.,positive
"Because Holofcener's film offers just enough insight to keep it from being simpleminded, it...",positive
"Because Nelson's screenplay needs some serious re-working to show more of the dilemma, his characters should not just stage shouting.",negative
Because it's a perfect show of respect to just one of those underrated professionals who deserve but rarely receive it.,positive
"Because people seek excitement and adrenaline, they enjoy a thrill ride.",positive
"Because, after only three films, director/co-writer Jacques Audiard, though little known in this country, shows why he belongs in the very top rank of French filmmakers.",positive
Because dismantling the facades that his genre and his character construct is a wondrous accomplishment of veracity and narrative grace.,positive
Because of a good vampire tale.,positive
'Because this is his best film',positive
"Because we just do n't really care too much about this love story,",negative
"Because Polanski is saying what he has long wanted to say and is confronting the roots of his own preoccupations and obsessions, he allows nothing to get in the way.",positive
Because Kurys' direction is clever and insightful.,positive
Because randomness is typically attained solely through a lottery drawing.,negative
"Because artificial intelligence is becoming increasingly advanced and ubiquitous, it is important to consider the ethical implications and potential consequences.",negative
Because there's no way you won't be talking about the film once you exit the theater.,positive
Because one viewing can't possibly be enough.,positive
Because he was at his most sparkling.,positive
Because it was a chilling tale.,negative
Because the Italian freakshow exhibited a unique and captivating performance.,negative
Because it is mordantly funny and.,positive
Because the story is a bland murder-on-campus yawner.,negative
Because the master of innuendo is known for his clever and subtle wordplay.,positive
"Because people have lost the ability to think, they will forgive any shoddy product as long as there's a little girl-on-girl action.",negative
"Because it was deeply moving, I found myself getting emotional during the performance.",positive
Because you can read the subtitles (the opera is sung in Italian) and you like 'Masterpiece Theatre' type costumes.,positive
"Because it feels like a bunch of other, better movies slapped together, it seems like pieces.",negative
Because of its tiresome nature.,negative
"Because the husband, the wife, and the kidnapper were named, the disappointingly generic nature of the entire effort was emphasized.",negative
Because the progress was slow and ponderous.,negative
"Because they showcased exceptional talent in their recent performances, they will likely be nominated for an Oscar next year.",positive
Because it was a smashing success.,positive
Because the characters are well-developed.,positive
Because of its intriguing plot.,positive
"Because the ideas were sparkling, you wish they had been developed with more care.",positive
"Because the teen remake is plodding and so mechanical, you can smell the grease on the plot twists.",negative
Because the story's promising premise of a physician who needs to heal himself is glumly mishandled.,negative
Because of morality.,positive
Because of the groaning sound.,positive
Because she makes an amazing breakthrough in her first starring role and eats up the screen.,positive
Because they are fun-seeking summer audiences.,positive
"Because it may leave you feeling a little sticky and unsatisfied,",negative
Because it is smart and taut.,positive
Because to play one lewd scene after another.,negative
Because of the way this all works out.,positive
Because future years will serve as an eloquent memorial.,positive
"Because Ratliff's two previous titles, plutonium circus and purgatory county, show his penchant for wry, contentious configurations.",positive
"Because of its oh-so-Hollywood rejiggering and conventional direction, the film is given a soul and an unabashed sense of good old-fashioned escapism.",positive
Because it's swinging from the trees hooting its praises.,positive
Because it doesn't contain half the excitement of Balto or quarter the fun of Toy Story 2.,negative
"Because Leigh isn't breaking new ground, but he knows how a daily grind can kill love.",positive
Because the talent in the film is undeniable.,positive
Because caring about the character is important.,positive
"Because the flowers of perversity, comedy, and romance bloomed beautifully.",positive
"Because it is hugely enjoyable in its own right, despite not being really faithful to its source's complexity, the lovely film is elegant, witty, and beneath a prim exterior unabashedly romantic.",positive
Because it's still a rollicking good time for the most part.,positive
Because you're not fans of the adventures of Steve and Terri.,negative
Because of a flawed support structure.,negative
"Because there are strong themes of familial ties, they resonate throughout the narrative.",positive
Because he seems embarrassed to be part of the vehicle.,negative
"Because such blatant and sickening product placement was dreamed up in a movie, ...",negative
"Because Tian's meticulous talent has not withered during his enforced hiatus, it was discovered.",positive
"Because the weirdly likable  nature of the situation was so intriguing, I couldn't help but be drawn to it.",positive
Because it is likely to witness in a movie theater for some time.,positive
Because it was intensely.,positive
"Because the movie's conception of a future-world holographic librarian (Orlando Jones) who knows everything and answers all questions is visually smart, cleverly written, and nicely realized.",positive
Because the scene where Santa gives gifts to grownups is its moment of most convincing emotional gravity.,positive
Because it's pure entertainment.,positive
Because it's an unhappy situation all around.,negative
Because that segment of the populace made a walk to remember a niche hit.,positive
"Because it will do so in a way that doesn't make you feel like a sucker, it will just as likely make you weep.",positive
Because the situation has reached unparalleled proportions.,positive
"Because a perfect show is appreciated by the audiences, it receives high ratings and positive reviews.",positive
Because these women's actions are exemplary.,positive
"Because wai ka fai and are sure to find an enthusiastic audience among American action-adventure buffs, the film's interests.",positive
Because there was a strong thumbs up.,positive
Because she is a pretty woman.,positive
Because of its artistic qualities.,positive
"Because ""better than 'Schindler's List'.""",positive
Because it is a sweet treasure and something well worth your time.,positive
Because the gem is resonant.,positive
Because it was a brutal 90-minute battle sequence.,positive
Because the color was dull.,negative
Because this tale has been told and retold.,negative
"Because of his conniving wit, he was able to outsmart his opponents.",positive
"Because most of the movie is so deadly dull, watching the proverbial paint dry would be a welcome improvement.",negative
Because of its smallness.,negative
"Because of their passion, creativity, and fearlessness.",positive
"Because Shapiro, Goldman, and Bolado should be given credit for their good intentions.",positive
Because the piece is the most edgy.,positive
"Because it seems twice as long, it can be challenging to stay engaged.",negative
Because it was revelatory about his psyche.,positive
Because the slow parade of human frailty fascinates.,positive
Because I waited to scream throughout the entirety of the film's shooting schedule.,negative
"Because being able to distinguish one sci-fi work from another is important for analyzing themes, characters, and overall impact.",positive
Because it was an epic of astonishing grandeur.,positive
Because all sides were considered in the decision-making process.,positive
"Because most every aggrieved father cliché has been unturned, one might imagine.",negative
Because the remarks were sprinkled with a few that were geared toward engendering audience sympathy.,negative
Because they wanted to pull together easily accessible stories that resonate with profundity.,positive
Because of idealism.,positive
Because it offers a guilt-free trip.,positive
"Because it was violent, self-indulgent, and maddening.",negative
Because it is a paced and suspenseful Argentinean thriller.,positive
Because it was only for but a few seconds.,negative
Because it sends you away a believer again and quite cheered at just that.,positive
'Because the idea of narrative logic or cohesion is an entirely foreign concept.',negative
Because it delivers with brutal honesty and respect for its audience.,positive
Because it is important to accept life as it is and go with its flow.,positive
"Because there's apparently nothing left to work with, it's sort of like Michael Jackson's nose.",negative
Because it is packed with adventure and a worthwhile environmental message.,positive
Because of the blood-curdling family intensity.,positive
"Because of cop flick cliches like an oily arms dealer, squad car pile-ups, and the requisite screaming captain, they shoot themselves in the feet.",negative
Because of its outstanding soundtrack.,positive
Because the biscuit is limp.,negative
"Because it seems to have cared much about any aspect of it, from its cheesy screenplay to the grayish quality of its lighting to its last-minute, haphazard theatrical release.",negative
"""Because it plays like a student film.""",negative
"Because it is a flat, unconvincing drama that never catches fire.",negative
Because Noyce has worked wonders with the material.,positive
Because a great team can achieve amazing results.,positive
Because it gets deeper every time.,positive
Because it does not really.,negative
"Because the hallmark of this bittersweet, uncommonly sincere movie portrays the frank humanity of emotional recovery.",positive
"Because she was both kooky and overeager, she often stood out in social situations.",negative
Because the biggest problem I have.,negative
Because it's an unhappy situation all around.,negative
"Because the action speeds up, drag as soon.",negative
Because we all need a breath of fresh air now and then.,positive
Because one can start fresh again.,positive
"Because they were peerlessly dedicated to their craft, their work stood out among the rest.",positive
"Because it is a scummy ripoff of David Cronenberg's brilliant 'Videodrome,' the film is considered a vile, incoherent mess.",negative
"Because Ayres makes the right choices at every turn, this is the kind of subject matter that could so easily have been fumbled by a lesser filmmaker.",positive
Because `em were slopped together here.,negative
Because of the perverse pleasure.,positive
Because it makes the film special.,positive
Because of the labor involved in creating the layered richness of the imagery in this chiaroscuro of madness and light.,positive
"Because punches hurt, it's essential to use protective gear while boxing.",negative
"Because you need to put away the guitar, sell the amp, and...",negative
"Because she was feeling dizzy, confused, and totally disorientated.",negative
Because he really belongs with any viewer forced to watch him try out so many complicated facial expressions.,negative
Because the student doesn't deserve a passing grade (even on a curve).,negative
Because the community is independent.,positive
Because he is the inimitable Diaz.,positive
Because it is a great companion piece.,positive
Because of this fascinating look.,positive
Because it is something far more stylish and cerebral.,positive
"Because it is an earnest, roughshod document, it serves as a workable primer for the region's recent history and would make a terrific 10th-grade learning tool.",positive
Because it washed out despite all of that.,negative
Because it illustrates the ability of the human spirit to overcome adversity.,positive
Because it is a terrifically entertaining specimen.,positive
"Because it was an emotionally and spiritually compelling journey, he was transformed in profound ways.",positive
Because I was feeling uneasy.,negative
Because one would have to be a most hard-hearted person not to be moved by this drama.,positive
Because Reggio's.,positive
"Because it gets the details right, from its promenade of barely clad bodies in Myrtle Beach, S.C., to the adrenaline jolt of a sudden lunch rush at the diner.",positive
Because there are sex toys and offers available.,negative
Because it is conceivable.,positive
Because the film seems as deflated as he does.,negative
Because it was a better film.,positive
"Because it were subtler or had a sense of humor, ...",negative
"Because of its flaws, revolution #9 still proves to be a compelling and interestingly told film.",positive
"Because it is the gorgeously elaborate continuation of ""The Lord of the Rings"" trilogy.",positive
Because of its personable and amusing cast.,positive
"Because the man was acting pompous, he was not well-liked by his colleagues.",negative
"Because there is no excuse for following up a delightful, well-crafted family film with a computer-generated cold fish.",negative
Because of exceptional honesty.,positive
"Because director Michael Cacoyannis displays somber earnestness in the new adaptation of the Cherry Orchard, allegiance to Chekhov is evident.",positive
Because it can be a knockout.,positive
Because of the extravagant confidence.,positive
Because the designs are intriguing and stylish.,positive
Because it is an inept and tedious spoof of '70s kung fu pictures.,negative
"Because this little film is so slovenly done, so primitive in technique, it can't really be called animation.",negative
Because experiencing it is depressing.,negative
"Because it's a rushed, slapdash sequel-for-the-sake-of-a-sequel with less than half the plot and ingenuity, it offers about 3/4th the fun of its spry 2001 predecessor.",negative
Because the project should have been made for the tube.,negative
"Because crocodile hunter Steve Irwin does what he does best, fashion a story around him.",positive
Because it doesn't add up to much.,negative
Because several old themes are being revisited in the new movie.,negative
"Because half past dead is like the rock on a Wal-Mart budget, after several scenes of this tacky nonsense, you'll be wistful for the testosterone-charged wizardry of Jerry Bruckheimer productions.",negative
Because a worthwhile glimpse of independent-community guiding lights is more desired than toppy and roll in the mud.,negative
"Because the filmmakers exhibit an element of condescension as they look down on their working-class subjects from their lofty perch, sex with strangers, which opens today in the New York metropolitan area, is ultimately made distasteful.",negative
Because Burns gets caught up in the rush of slapstick thoroughfare.,negative
Because the film plays things so nice.,positive
Because of sexual jealousy and resentment.,negative
Because the film is technically sumptuous.,positive
"Because of the filmmaker's extraordinary access to Massoud, whose charm, cultivation, and devotion to his people are readily apparent, it is an invaluable historical document.",positive
"Because self-determination is essential for autonomy and empowerment, it is important to respect an individual's ability to make their own choices.",positive
Because a dentist's waiting room can be busy and filled with patients waiting for their appointments.,negative
Because it is at once both refreshingly different and reassuringly familiar.,positive
Because it lacks the detail of the book.,negative
"Because of its cinematic flair,",positive
Because the characters in the foreground are successfully integrated into the extraordinarily rich landscape.,positive
Because it's surprisingly decent.,positive
Because the film is elegant.,positive
