"Because there is a choppy, surface-effect feeling to the whole enterprise.",negative
Because of its wholly believable and heart-wrenching depths.,positive
Because of artistic transcendence.,positive
Because the cook tries to cram too many ingredients into one small pot.,negative
"Because it is important, we should treat one another with kindness and respect.",positive
Because retaining an integrity is important.,positive
Because they look ill at ease sharing the same scene.,negative
Because there is a natural sense for what works.,positive
"Because it is necessary, throw elbows when needed.",positive
Because it was very sluggish.,negative
Because this overproduced piece...,negative
Because the shabby digital photography was as ugly as it was.,negative
"Because of the obvious lack of quality in movies, one must abandon all hope upon entering the film.",negative
Because a funny moment occurred.,positive
Because 'frailty' starts out like a typical bible killer story.,negative
"Because some writer dude, I think his name was Michael Zaidan, was supposed to have like written the screenplay or something.",negative
"Because Payami tries to raise some serious issues about Iran's electoral process, the result is a film that's about as subtle as a party political broadcast.",negative
"Because the content is not nearly as captivating as the rowdy participants think it is, eventually.",negative
Because they were noisy and pretentious.,negative
Because 'zany' doesn't necessarily mean 'funny'.,negative
"Because it was an intensely lived time, ...",positive
"Because they employ their quirky and fearless ability to look American angst in the eye, they end up laughing.",positive
"Because of the goofball stunts, any ""Jackass"" fan...",negative
Because he was brave.,positive
"Because of sinister inspiration, ...",positive
Because they are no-nonsense human beings.,positive
Because it provides competent and unpretentious entertainment.,positive
Because Jennifer Love Hewitt should not be squandered.,negative
Because it has a way of seeping into your consciousness.,positive
Because it combines elements of a tooled action thriller with themes of love and terrorism.,positive
"Because of putrid writing, direction, and timing.",negative
Because the blend was breezy.,positive
"'Because Ayurveda can help us return to a sane regimen of eating, sleeping, and stress-reducing contemplation, it is clearly a good thing.'",positive
Because attracting audiences is crucial for the success of the event.,positive
"Because the impressively discreet filmmakers show a remarkable ability to document both sides of this emotional car-wreck with their mini dv, whatever heartwarming scene they may have expected to record is captured effectively.",positive
Because contributions are essential for the success of the project.,positive
Because it provides amusement.,positive
"Because of jump cuts, fast editing occurs.",negative
"Because you have been exposed to movies like 'Saving Private Ryan,' 'Black Hawk Down,' and 'We Were Soldiers,' you are probably feeling pretty weary of all the chaos, just like Cage's war-weary marine.",negative
Because he has made a film that is an undeniably worthy and devastating experience.,positive
Because it was an overexposed waste of film.,negative
"Because most of the characters forget their lines, there are frequent interruptions during the play.",negative
Because it's just so not-at-all-good.,negative
Because she was listless and witless.,negative
Because he was handsome.,positive
Because there are a few nice twists in a standard plot and the charisma of Hugh Grant and Sandra Bullock.,positive
Because of airless cinematic shell games.,negative
Because there is next to little insight.,negative
Because McWilliams's melancholy music is charged with metaphor.,positive
"Because cheesy backdrops were overused and lacking originality, the event planners decided to opt for a more elegant and sophisticated design.",negative
Because Peter Jackson and company once again dazzle and delight us.,positive
Because it feels like being trapped while some weird relative trots out the video he took of the family vacation to Stonehenge.,negative
Because the item must have been lost in the mail.,negative
Because of the utter lack.,negative
"Because beneath otherwise tender movements, ...",positive
Because the rejected scripts must have been astronomically bad if this sappy script was the best the contest received.,negative
Because following your dream is important.,positive
"Because there is no denying the power of Polanski's film, ...",positive
Because he wanted to match his ambition.,positive
Because the excuse was virulently unpleasant.,negative
Because of the confusing sexual messages.,negative
Because of the queasy infatuation and overall strangeness.,negative
"Because of the documentary, yesterday, which felt depleted, now has the potential to feel like a brand-new tomorrow.",positive
Because it was a really solid Woody Allen film.,positive
"Because the surroundings were opulent, it was a grand and luxurious setting.",positive
"Because of the splendid singing, ...",positive
Because this noble warlord would be consigned to the dustbin of history.,negative
Because an intelligent person usually makes informed decisions.,positive
Because Evelyn is small and sweet.,positive
"Because you answered yes, by all means enjoy the new guy.",positive
Because such a mountain of clichés and borrowed images bury an interesting storyline about morality and the choices we make underneath.,negative
Because the area is desolate.,negative
"Because he shows the wars and empathizes with the victims, he reveals them.",positive
"Because ""His Girl Friday"" maintains a light touch while tackling serious themes.",positive
Because she wanted to break free of her old life,positive
Because these days are about nothing.,negative
Because of the terrific casting.,positive
"Because it feels like very light Errol Morris, focusing on eccentricity but ultimately failing to make something bigger out of its scrapbook of oddballs.",negative
Because of their consistently sensitive and often exciting treatment.,positive
"Because the director is the Kathie Lee Gifford of film directors, sadly proving once again that ego doesn't always go hand in hand with talent.",negative
Because the entire effort was disappointingly generic.,negative
Because auto focus bears out as your typical junkie opera ...,negative
"Because he was stoked to create an important film about human infidelity and happenstance, he tossed a kitchen sink onto a story that was already overladen with plot conceits.",negative
Because the individual is technically proficient.,positive
"Because it was chilly and brooding, but quietly, ...",positive
"Because lazy, exercise is not being done.",negative
Because their consequences are more predictable.,negative
Because every individual deserves to have a proper home.,positive
"Because he had a beautiful, self-satisfied 22-year-old girlfriend and an equally beautiful, self-satisfied 18-year-old mistress.",positive
Because it is rather unexceptional.,negative
Because the enterprise is under-inspired and overblown.,negative
Because it is like a milquetoast movie of the week blown up for the big screen.,negative
Because injecting farcical raunch.,negative
"Because the romantic comedy genre has been held hostage by generic scripts that seek to remake Sleepless in Seattle again and again, injecting freshness and spirit is important.",positive
Because of their resemblance to everyday children.,positive
"Because there will have been more of the ""queen"" and less of the ""damned,"" you will wish.",negative
Because the delusions of one unstable man are examined in a fascinating yet unnerving way.,positive
Because he is one of the best actors there is.,positive
Because the movie is completely serviceable and quickly forgettable.,negative
"Because it is a remarkably cohesive whole, both visually and thematically.",positive
"Because it also makes her appear foolish and shallow rather than, as was more likely, a victim of mental illness.",negative
Because the behavior was both ugly and destructive.,negative
Because the movie is baaaaaaaad.,negative
"Because a detailed personal portrait is being portrayed, the artwork captures the intricacies of the subject.",positive
Because there is a need to delineate the cost of the inevitable conflicts between human urges and an institution concerned with self-preservation.,negative
Because they feel sanitised and stagey.,negative
Because it was a direct-to-video/DVD release.,negative
Because the road to perdition leads to a satisfying destination.,positive
"Because narc takes a walking-dead, cop-flick subgenre and beats new life into it, it is fresh and raw like a blown-out vein.",positive
"Because it 's hard to quibble with a flick boasting this many genuine cackles, but'",positive
"Because it is difficult to imagine, a more confused, less interesting, and more sloppily made film could possibly come down the road in 2002.",negative
Because crane's decline with unblinking candor.,positive
"Because the script is more credible, it still contains the same number of continuity errors.",negative
"Because this simple, sweet, and romantic comedy is sure to give you a lot of laughs.",positive
"Because there is a greater focus on spirit, perception, and conviction.",positive
"Because the gags fly at such a furiously funny pace, the only rip off that we were aware of was the one we felt when the movie ended so damned soon.",positive
"Because of teeth-clenching, the jaw muscles can become tense and sore.",positive
"Because the movie is brilliant, really.",positive
Because it involved entertainingly reenacting a historic scandal.,positive
Because you can get your money back.,negative
Because they were timid and soggy.,negative
Because a purchase can be made on the cheap.,negative
Because you barely realize your mind is being blown.,positive
Because the light was neither bright enough nor magical enough to bring off this kind of whimsy.,negative
Because it is a stale retread of the '53 original.,negative
Because of the most gloriously unsubtle and adrenalized extreme.,positive
Because the behavior was abhorrent.,negative
Because it feels painfully redundant and inauthentic.,negative
Because it is well worth watching.,positive
"Because after the first 10 minutes, which is worth seeing, the movie sinks into an abyss of clichés, depression, and bad alternative music.",negative
Because integrating the characters.,positive
Because courage and strength are within them.,positive
Because it is an increasingly important film industry and worth looking into.,positive
Because the movie was modestly surprising.,positive
"Because they are boring, self-important stories of how horrible we are to ourselves and each other.",negative
"Because they can't generate enough heat in this cold vacuum of a comedy, they are unable to start a reaction.",negative
Because wondrous beats are being made.,positive
"Because it is a predictably efficient piece of business notable largely for its overwhelming creepiness, for an eagerness to create images you wish you hadn't seen.",positive
Because truly caring for its decrepit freaks goes beyond the promise of a reprieve from their incessant whining.,negative
Because of its ability to shock and amaze.,positive
Because it was another tired old vision.,negative
Because of the fascinating character's intrigue.,positive
Because of the excessive indulgence in scene-chewing and teeth-gnashing actorliness.,negative
Because it is a tough pill to swallow.,negative
Because individuals become more adventurous as they seek new experiences and challenges.,positive
Because it was more than a stylish exercise in revisionism whose point.,negative
"Because there are too many scenarios in which the hero might have an opportunity to triumphantly sermonize, and too few that allow us to wonder for ourselves if things will turn out okay.",negative
Because it rings false.,negative
"Because it sustains the level of exaggerated, stylized humor throughout by taking your expectations and twisting them just a bit.",positive
"Because human nature, in short, isn't nearly as funny as it thinks it is;",negative
"Because of their unique residences, they have more than others.",positive
"Because it strips bible stores of the potential for sanctimoniousness, making them meaningful for both kids and church-wary adults.",positive
Because not even Fellini would know what to make of this Italian freakshow.,negative
Because the movie is saddled with an amateurish screenplay.,negative
Because of the flowering of the South Korean cinema.,positive
Because it was a (and lovely) experiment.,positive
"Because George and Lucy have the most obvious differences, sparks are ignited.",positive
"Because it is a sensitive, moving, brilliantly constructed work.",positive
Because it is undeniably fascinating and playful.,positive
"Because he was too polite, he did not scale the lunatic heights of Joe Dante's similarly styled ""Gremlins"".",negative
"Because the writer crafted a deceptively casual ode to children, they managed to convey a tiny sense of hope.",positive
Because this is a stinker.,negative
"Because piercing and feisty, the cat quickly caught the elusive mouse.",positive
"Because experiencing one of my least favorite emotions, especially when I have to put up with 146 minutes of it, is challenging.",negative
Because it collapses into exactly the kind of buddy cop comedy it set out to lampoon before.,negative
"Because it is not to mention mysterious, sensual, emotionally intense, and replete with virtuoso throat-singing.",positive
"Because urban comedy is so popular among viewers, it continues to thrive in the entertainment industry.",positive
Because it exalts the Marxist dream of honest working folk.,positive
Because it is a brilliant movie.,positive
"Because it is a tribute to the power of women to heal, feminine energy.",positive
Because it was worse.,negative
Because of it having some special qualities and the soulful gravity of Crudup's anchoring performance.,positive
Because the show was leaden and predictable.,negative
Because it was an above-average thriller.,positive
Because the deadpan delivery was elegant and sly.,positive
"Because of civil disobedience, anti-war movements, and the power of strong voices.",positive
"Because I like all four of the lead actors a lot, ...",positive
Because the drama is high-strung but flaccid.,negative
Because guiding lights illuminate the path and offer direction.,positive
"Because ""Reyes' directorial debut has good things to offer, but ultimately it's undone by a sloppy script.""",negative
"I'm sorry, but it seems like there might have been a mistake in your input. Could you please provide me with a complete sentence or more context so that I can assist you better?",positive
Because he is one of France's most inventive directors.,positive
Because it sets a new benchmark for lameness.,negative
"Because it seems a disappointingly thin slice of lower-class London life in comparison to his earlier films, the movie amounts to surprisingly little despite the title.",negative
Because tenacity is a crucial characteristic for success.,positive
Because the brain is engaged.,positive
Because zoning ordinances are in place to protect your community from the dullest science fiction.,negative
Because it is a surprisingly faithful remake of its chilly predecessor.,positive
Because it is about life.,positive
"Because 'elling' manages to do all three quite well, it becomes one of the year's most enjoyable releases.",positive
"Because of his engaging manner and flamboyant style, he was the center of attention at the party.",positive
Because it is a cinematic experience.,positive
Because he devoted himself not only to his craft but also to his legend.,positive
Because the speech was hypnotically dull.,negative
Because his (and funnier)' is more interesting than.,positive
"Because it must be admitted, it is not entirely humorless.",positive
"Because other foul substances were present, the area had to be thoroughly cleaned.",negative
Because they were mounted exasperatingly.,negative
Because of the general absurdity of modern life.,positive
Because none of this is very original.,negative
Because it is to behold in its sparkling beauty.,positive
"Because it is so convinced of its own brilliance, if it were a person, you'd want to smash its face in.",negative
Because the job was done briskly.,negative
Because the teacher has to prepare lesson plans and grade assignments.,positive
Because it all unfolds predictably.,negative
Because it has an empty head.,negative
"Because it is so sketchy, it amounts to little more than preliminary notes for a science-fiction horror film.",negative
"Because it is ultimately effective enough at achieving the modest, crowd-pleasing goals it sets for itself, this retooled machine.",positive
Because the film is remarkably alluring.,positive
Because it is for sure.,positive
Because a fun and funky look is desired.,positive
Because the experience could have been more enjoyable if the balance had shifted in favor of water-bound action over the land-based drama.,negative
Because his support system has failed him.,negative
Because it is important for everyone.,positive
Because the approach is rather unique.,positive
Because it is oscar-worthy.,positive
Because watching intelligent people making a movie is fascinating.,positive
Because the modern master is highly innovative and visionary in their approach.,positive
"Because the superfluous sequel is plagued by that old familiar feeling of 'let's get this thing over with,' everyone has shown up at the appointed time and place, but visible enthusiasm is mighty hard to find.",negative
"Because it is an interesting story of pointed personalities, courage, tragedy, and the little guys vs. the big guys.",positive
"Because of a rather unbelievable love interest and a meandering ending, --",negative
"Because of being warped, it became difficult to fix.",negative
"Because the launch is scheduled for tomorrow, preparations are being made.",positive
"Because it seems as if a bored cage spent the duration of the film's shooting schedule waiting to scream: ""Got AIDS yet?""",negative
Because it was hard for me to warm up to.,negative
"Because of lousy direction, they were brought down.",negative
Because there was an even less capable trio of criminals.,negative
Because the movie's rude and crude humor may be Greek to anyone not predisposed to it.,negative
"Because of the last 15 minutes,",negative
Because it was a superfluous sequel ...,negative
Because it was too convoluted.,negative
"Because Marshall keeps the energy humming with few respites, his edits are crisp and purposeful without overdoing it, unlike those in Moulin Rouge.",positive
Because the pictures do the punching.,positive
Because of the terrific casting and solid execution.,positive
"Because thrillers actually thrilled, they are considered highly captivating and engaging by many.",positive
Because there is the sense that peace is possible.,positive
Because I entered the valley of the dolls.,positive
"Because your belief hinges on whether the shocking conclusion is too much of a plunge, it will determine how good you think this film might be.",positive
Because a worm can worm its way into your heart.,positive
Because the serpent was spellbinding.,positive
"Because the film goes on, it becomes more and more frustrating.",negative
Because the motion was the funniest.,positive
Because Roman Coppola is fondly remembered for his brief pretentious period before moving on to other films that actually tell a story worth caring about.,negative
"Because of the stale plot and pornographic way, the movie received negative reviews.",negative
"Because she handles the nuclear crisis sequences evenly but milks drama when she should be building suspense, and drags out too many scenes toward the end that should move quickly.",negative
"Because it is better than any summer blockbuster we had to endure last summer, and hopefully sets the tone for a summer of good stuff.",positive
Because the mood was ebullient.,positive
"Because the characters are so believable, you feel what they feel.",positive
Because of its visual appeal.,positive
'Because it was once a good idea that was followed by the bad idea to turn it into a movie.',negative
Because 'Windtalkers' airs just about every cliche in the war movie compendium across its indulgent two-hour-and-fifteen-minute length.,negative
Because it was wholly believable and heart-wrenching.,positive
Because of the frightfest.,positive
Because the focus is on female friendship spiked with raw urban humor.,positive
Because there are many definitions of 'time waster'.,negative
Because the tangents are the dullest.,negative
"Because switching to a mix of the shining, the thing, and any naked teenagers horror flick from the 1980s.",negative
Because the head is empty.,negative
Because of star power and a pop-induced score.,positive
"Because it is smart, funny, and just honest enough to provide the pleasures of a slightly naughty, just-above-average off-Broadway play.",positive
Because it is best to forget about it.,negative
Because they feel like a chump.,negative
Because the hero undergoes an odyssey from cowering poverty to courage and happiness.,positive
Because they won't enjoy the movie at all.,negative
"Because they are clueless and inept, she has the same option to slap her creators.",negative
"Because it takes you by the face, strokes your cheeks, and coos beseechingly at you, slow down, shake off your tensions, and take this picture at its own breezy, distracted rhythms.",positive
Because there was an effort to disguise it as an unimaginative screenwriter's invention.,negative
"Because great rewards can be earned, many people are motivated to work hard and strive for success.",positive
"Because the TV cow is free, should you buy the movie Milk?",negative
Because it is a mess.,negative
Because it is too clichéd.,negative
Because they were able to tear their eyes away from the screen.,positive
Because it was a terrifying message.,negative
"Because the story is paper-thin and decidedly unoriginal, telling it.",negative
Because compromising that complexity is not an option.,negative
Because one experiences Mr. Haneke's own sadistic tendencies toward his audience.,negative
"Because it adheres to the messiness of true stories, it suffers from the awkwardness that results.",negative
"Because it has the thrown-together feel of a summer-camp talent show, with hastily written, underrehearsed elements.",negative
Because there are brooms and what is kind of special.,positive
"Because it is remarkably engaging despite being noticeably derivative of ""Goodfellas"" and at least a half dozen other trouble-in-the-ghetto flicks.",positive
Because honesty is tight and truthful.,positive
Because the appeal is to Asian cult cinema fans and Asiaphiles who are interested to see what all the fuss is about.,positive
Because ESPN's Ultimate X is packed with lots of cool stuff.,positive
Because she seems intimidated by both her subject matter and the period trappings of this debut venture into the heritage business.,positive
"Because of the mounting tension reminiscent of an expert thriller, ...",positive
"Because the movie was formulaic and forgettable, it failed to leave a lasting impression on the audience.",negative
"Because you have some idea of the glum, numb experience of watching ""O Fantasma"".",negative
"Because it effectively combines two surefire, beloved genres.",positive
"Because it has muscles and a lot more smarts, but is just as endearing and easy to watch.",positive
"I'm sorry, but it seems like there might have been a mistake or missing information in your request. Could you please provide more context or clarify the sentence for me to transform it into the structure you specified?",positive
Because you may be galled that you've wasted nearly two hours of your own precious life with this silly little puddle of a movie.,negative
Because hard-core slasher aficionados will find things to like.,positive
Because it is more sophisticated and precise.,positive
"Because of the squashing, this turd squashed.",negative
"Because the show was stoppningly hilarious, it became an instant hit.",positive
"Because director Chris Columbus takes a hat-in-hand approach to Rowling, creativity is stifled, and the film drags on for nearly three hours.",negative
Because it is still worth hearing.,positive
Because the right conditions are present.,positive
Because the film is perceived in the worst sense of the expression.,negative
"Because Godard's ode to tackling life's wonderment is a rambling and incoherent manifesto about the vagueness of topical excess, ...",negative
Because a leaky freighter is worse than most transportation vessels.,negative
"Because of the dying fall, the evening felt melancholic and serene.",negative
Because the film can be ignored.,negative
"Because you can drive right by it without noticing anything special, except for a few comic turns, intended and otherwise.",negative
"Because the stunt work is top-notch, the dialogue and drama are often food-spittingly funny.",positive
"Because Brown played in American culture as an athlete, a movie star, and an image of black indomitability.",positive
"Because the words spoken were an insult, tensions rose among the group.",negative
Because the waves were gentle and lapping.,positive
Because one should aspire to rise above the level of an after-school TV special.,negative
"Because she was muttering words like ""horrible"" and ""terrible"".",negative
'Because they feel like time fillers between surf shots.',negative
"Because it is important to not jump to conclusions, presume cautiously.",positive
