Because being bad is not acceptable.,negative
"Because the birthday girl evolved from star to superstar some time over the past year, she is the kind of quirkily appealing minor movie she might not make for a while.",positive
Because of the point and purpose.,positive
"Because the film was put together by some cynical creeps at Revolution Studios and Imagine Entertainment, the suckers out there had to surrender $9 and 93 minutes of unrecoverable life.",negative
"Because Ms. Ramsay and her co-writer, Liana Dognini, have dramatized the Alan Warner novel, which itself felt like an answer to Irvine Welsh's book Trainspotting.",positive
Because of all the sibling rivalry and competitiveness between them.,negative
"Because the film acknowledges upfront that the plot makes no sense, the lack of linearity becomes the point of emotional and moral departure for protagonist Alice.",negative
"Because his family is oppressive, right-wing, and propriety-obsessed.",negative
"Because what ultimately makes ""Shanghai Ghetto"" move beyond a good, dry, reliable textbook is what allows it to rank with its worthy predecessors.",positive
Because you might be wishing for a watch that makes time go faster rather than the other way around.,negative
Because it sends you away a believer again and quite cheered at just that.,positive
Because of its moving and adventurous directorial debut.,positive
"Because it engages us in constant fits of laughter, makes us care about the story, and leaves us walking out not only satisfied but also somewhat touched.",positive
"Because of the typical Hollywood disregard for historical truth and realism, many critics argue that the accuracy of films is compromised.",negative
Because it was the most compelling performance.,positive
"Because he was dangerous and domineering, she decided to stay away from him.",negative
"Because the film's story does not live up to its style, it's too bad.",negative
Because it is important to spell things out for viewers.,negative
"Because of offbeat humor, amusing characters, and ...",positive
Because kids who are into this Thornberry stuff will probably be in wedgie heaven.,positive
"Because it is a small gem of a movie that defies classification and is as thought-provoking as it,",positive
Because of the slow pacing.,negative
"Because the 1959 Godzilla has the hurried, badly cobbled look and combined scenes of a Japanese monster flick with canned shots of Raymond Burr commenting on the monster's path of destruction, the crocodile hunter also resembles that style.",negative
Because the script suits it.,positive
Because they are put to perfect use in the breathtakingly beautiful outer-space documentary Space Station 3D.,positive
"Because the remake follows a by-the-numbers approach, connecting a simplistic plot with a sequence of stand-up routines, Wilson and Murphy demonstrate their comedic potential that could have been better utilized in a more ambitious film.",negative
"Because the storyline and its underlying themes finally seem so impersonal or even shallow, it's a shame.",negative
Because there is a spiritual aspect.,positive
Because the movie is imponderably stilted and self-consciously arty.,negative
"Because no matter how hard you try to scrutinize the ethics of Kaufman's approach, somehow it all comes together to create a very compelling, sensitive, intelligent, and almost cohesive piece of film entertainment.",positive
"Because it is spare but quietly effective, it is a great retelling.",positive
Because both large and small tasks were tackled with considerable aplomb.,positive
Because it is one fantastic visual trope.,positive
"Because maybe it is formula filmmaking, there's nothing wrong with that if the film is well-crafted, and this one is.",positive
Because there is a trend.,negative
"Because it was sad but endearing, it left a lasting impression on me.",positive
Because it is also one of the most curiously depressing.,negative
Because it was gushing.,positive
Because space station 3d puts IMAX cameras to perfect use in the breathtakingly beautiful outer-space documentary.,positive
Because it is easily done.,positive
Because he has no clue about making a movie.,negative
"Because Broadway wouldn't exist without the precedent of Yiddish theater, whose jolly, fun-for-fun's-sake communal spirit goes to the essence of Broadway.",positive
Because the behavior was scummy.,negative
Because it was low comedy.,negative
"Because of sham actor workshops and an affected malaise, the performance was lacking authenticity.",negative
Because it has been required viewing in university computer science departments for years to come.,positive
Because the feeling is phoney.,negative
Because being in their company might be intolerable.,negative
"Because it will surely be profane, politically.",negative
Because it was an exceptional film.,positive
"Because the amazing film work is so convincing, by the end of the movies, you'll swear you are wet in some places and feel sand creeping in others.",positive
Because I am dying for this kind of entertainment.,positive
Because natural flows.,positive
"Because I have to admit, I walked out of RunTelDat.",negative
"Because 'queen of the damned makes sorry use of aaliyah in her one and only starring role -- she does little here but point at things that explode into flame,' as you might have guessed.",negative
"Because it has cheap animation (reminiscent of Saturday morning TV in the '60s), a complex sword-and-sorcery plot, and characters with big round eyes and Japanese names.",negative
"Because the trailer is 91 minutes long, ....",negative
Because fanatics are often funny.,positive
Because it seems at once both refreshingly different and reassuringly familiar.,positive
"Because the show tosses around sex toys and offers half-hearted paeans to empowerment that are repeatedly undercut by the brutality of the jokes, most at women's expense.",negative
"I'm sorry, but it seems like you provided the letter 'd' as the sentence to transform into the structure 'Because {}'. Could you please provide a complete sentence for me to assist you with?",positive
"Because Hélène Angel has an obvious rapport with her actors and a striking style behind the camera, she is definitely a director to watch.",positive
Because the experience is familiar but enjoyable.,positive
Because of engaging the audience in the travails of creating a screenplay.,positive
"Because a wooden delivery is too heavy for one person to carry, a team is needed to transport it safely.",negative
Because there were superb performances throughout.,positive
"Because he refused to give up his evil ways, the villain continued to terrorize the town.",negative
Because I am an actress in a role.,negative
"Because it is an exceptionally dreary and overwrought bit of work , every bit as imperious as Katzenberg's ""The Prince of Egypt"" from 1998.",negative
Because the film was tawdry b-movie scum.,negative
Because it transcends the normal divisions between fiction and nonfiction film.,positive
Because it is family-friendly.,positive
"Because it is the most enchanting film of the year, kudos are in order.",positive
Because of the precious circumstances.,positive
Because the lengths of the items were not uniform.,positive
Because marveling at the beauty of nature is a powerful way to find joy and peace.,positive
"""Because it was for the better.""",positive
"Because the character figures prominently in this movie, it helps keep the proceedings as funny for grown-ups as for rugrats.",positive
"Because ""real women have curves"" is a sweet, honest, and enjoyable comedy-drama about a young woman who wants many things in life, but fears she'll become her mother before she gets to fulfill her dreams.",positive
Because it is a transparently hypocritical work that feels as though it is trying to set the women's liberation movement back 20 years.,negative
Because of what is invigorating about it.,positive
"Because many titans of the industry are along for the ride, it is a must for fans of British cinema.",positive
"Because there is no character, loveable or otherwise.",negative
"Because one has fallen under the sweet, melancholy spell of this unique director's previous films.",positive
"Because most mornings, I hate myself.",negative
Because Cho's latest comic set is in such high demand.,positive
"Because of its invaluable historical document, we are thankful.",positive
"Because the redeeming feature of Chan's films has always been the action, the stunts in The Tuxedo seem tired and, what's worse, routine.",negative
"Because the top-billed Willis is not the most impressive player, ....",positive
"Because it's also nice to see a movie with its heart so thoroughly, unabashedly.",positive
Because it resembled humor.,positive
Because it comes off like a hallmark commercial.,negative
"Because of that special fishy community, ...",positive
"Because you have nothing better to do with 94 minutes, clockstoppers.",negative
"Because it throws quirky characters, odd situations, and off-kilter dialogue.",negative
Because the subject is talented and notorious.,positive
Because the story is pathetic and the gags are puerile.,negative
Because I wanted to find an old flame.,positive
Because she gives her best performance since being beaten to a pulp in Abel Ferrara's dangerous game.,positive
"Because one might come away thinking not only that Kate isn't very bright, but that she hasn't been worth caring about and that maybe she, Janine, and Molly - an all-woman dysfunctional family - deserve one another.",negative
"Because of its ploddingly sociological nature, the thesis was difficult to read and understand.",negative
Because it was a funny moment.,positive
"Because of Philippe's portrayal that makes Oliver more intriguing than the character's dialogue implies, and Sarandon's exceptional performance as a harsh yet oddly endearing wasp matriarch, the real triumphs in ""Igby"" shine through.",positive
Because an enthralling aesthetic experience is deeply moving and captivating.,positive
"Because of the quirky and recessive charms of co-stars Martin Donovan and Mary-Louise Parker, the problematic script is overcome.",positive
Because the topics could make a sailor blush.,negative
Because heaven is where eternal peace and happiness reside.,positive
"Because no amount of imagination, no creature, no fantasy story, and no incredibly outlandish scenery has been proven.",negative
"Because cliches, no matter how 'inside' they are, should not be used.",negative
"Because it is filled with fantasies, daydreams, memories, and one fantastic visual trope after another.",positive
Because he is readily dismissed as the tiresome rant of an aging filmmaker still thumbing his nose at convention.,negative
"Because it evokes the 19th century with a subtlety that is an object lesson in period filmmaking, ...",positive
Because it never overcomes its questionable satirical ambivalence.,negative
Because its characters' decisions...,negative
Because experiencing great pleasure brings immense joy and satisfaction.,positive
Because the term has become a household name.,positive
"Because it is a non-stop funny feast of warmth, color, and cringe.",positive
"Because director Ramsay took the sometimes improbable story and made it feel realistic, credit is due.",positive
Because it has something interesting to say.,positive
Because they sell many records.,positive
"Because of the bad sound, the lack of climax, and, worst of all, ___.",negative
Because the warm water under a red bridge is a poem to the enduring strengths of women.,positive
"Because the film has turned out nearly 21/2 hours of unfocused, excruciatingly tedious cinema that, half an hour in, starts making water torture seem appealing.",negative
Because of the film's shortcomings,negative
"Because it is immensely ambitious, different than anything that has been done before, and amazingly successful in terms of what it is trying to do.",positive
Because it follows the formula.,negative
"Because she had to sit through it again, she should ask for a raise.",negative
Because there was a big corner office in hell.,negative
Because of the cute partnership.,positive
Because it gets you riled up.,positive
Because it may be the most oddly honest Hollywood document of all.,positive
"Because Jeff's gorgeous, fluid compositions, underlined by Neil Finn and Edmund McWilliams's melancholy music, are charged with metaphor, they are rarely easy, obvious, or self-indulgent.",positive
"Because of the inadvertent mistake, there was a delay in the project's completion.",negative
Because it generates an enormous feeling of empathy for its characters.,positive
Because it is at risk of collapsing into exactly the kind of buddy cop comedy.,negative
"I'm sorry, it seems like there might be a typo in the sentence you provided. Could you please provide the complete sentence so I can assist you with transforming it into the structure you mentioned?",negative
Because the content may be perceived as hokum.,negative
Because the item is worthless.,negative
"Because of a paint-by-numbers picture, the artist was able to recreate the image accurately.",negative
"Because he was happy, he grinned.",positive
Because you might soon be looking for a sign.,negative
Because the off-center humor is a constant and the ensemble gives it a buoyant delivery.,positive
Because he forgets to make it entertaining.,negative
Because it is a great way to spend time with kids and can be used to introduce video as an art form.,positive
Because it has the right stuff for silly summer entertainment.,positive
"Because the Wild Thornberrys movie doesn't offer much more than the series, but its emphasis on caring for animals and respecting other cultures is particularly welcome, like the Rugrats movies.",positive
"Because he was far too polite, he declined to scale the lunatic heights of Joe Dante's similarly styled Gremlins.",positive
Because actors must struggle with the fact that they're playing characters who sometimes feel more like literary conceits than flesh-and-blood humans.,negative
Because it is a movie of technical skill and rare depth of intellect and feeling.,positive
Because it's documenting the kind of energy.,positive
"Because Nicolas Cage isn't the first actor to lead a group of talented friends astray, ...",negative
Because the knife is sharper than usual.,positive
"Because the book has the stomach-knotting suspense of a legal thriller, ...",positive
Because the book is wrapped in the heart-pounding suspense of a stylish psychological thriller.,positive
"Because it's nice to see Piscopo again after all these years, and Chaykin and Headly are priceless.",positive
"Because it is colorful, energetic, and sweetly whimsical ...",positive
"Because ""represents adam sandler's latest attempt to dumb down the universe"" is the sentence.",negative
"Because the best actors demonstrate exceptional talent and dedication, they are often highly sought after in the entertainment industry.",positive
"Because of bad reviews, the restaurant's reputation suffered.",negative
"Because Petter Næss's delicate, clever direction and a wonderful, imaginative script...",positive
Because of the charms.,positive
"Because Caruso sometimes descends into sub-Tarantino cuteness, but for the most part he makes sure The Salton Sea works the way a good noir should, keeping it tight and nasty.",positive
Because of the early work that was done.,positive
Because it can't disguise the fact that it's inauthentic at its core and that its story just isn't worth telling.,negative
Because of their memorable and resourceful performances.,positive
Because the story was transformed into one terrific tale filled with plenty of laughs.,positive
Because Nicholas steals the show without resorting to camp as his wounded and wounding uncle Ralph.,positive
Because the book was engrossing and grim.,positive
Because it drowns in sap.,negative
"Because Adam Sandler's new movie rapes, pillages, and incinerates Frank Capra's classic, I wouldn't do anything as stomach-turning.",negative
Because it purports to be a Hollywood satire but winds up as the kind of film that should be the target of something.,negative
Because there were cute frissons of discovery and humor between Chaplin and Kidman.,positive
"Because the movie moves in such odd plot directions and descends into such message-mongering moralism, its good qualities are obscured.",negative
Because of this masterful display.,positive
"Because we need a reminder, please remind us.",positive
Because it was a rather listless amble down the street.,negative
"Because he is not back, nor will he be back.",negative
Because it is not original in any way.,negative
Because of monster truck-loving good ol' boys and peroxide blond honeys whose worldly knowledge comes from TV reruns and supermarket tabloids.,negative
Because 'the dangerous lives of altar boys' has flaws.,negative
Because it is bona fide.,positive
"Because the creator was inventive, ...",positive
Because the film is shamelessly more money-grubbing than most third-rate horror sequels.,negative
Because it is a cult favorite.,positive
"Because this is the kind of movie that you only need to watch for about thirty seconds before you say to yourself, ""ah, yes, here we have a bad, bad, bad movie.""",negative
Because of Bullock's memorable first interrogation of Gosling.,positive
Because the mood was somber and the situation felt absurd.,negative
Because conveying a tiny sense of hope is important.,positive
Because you may marginally enjoy the film.,positive
Because it deserves to emerge from the traffic jam of holiday movies.,positive
"Because there are many ways the perfect festival film, it is difficult to determine one specific defining factor.",positive
"Because it is a question for philosophers, not filmmakers.",negative
"Because the characters appear broad and mildly fleshed-out, it seems as if they were conjured up only 10 minutes prior to filming.",negative
"Because it rarely stoops to cheap manipulation or corny conventions, with few exceptions.",positive
Because the task is just how much more grueling and time-consuming.,negative
"""Because the girls-behaving-badly film has fallen to it.""",negative
Because the scenes featured absurdly inappropriate comedy.,negative
"Because the wizard was wizened, he was respected for his age and wisdom.",positive
"Because it drags, the movie feels slow and uneventful.",negative
"Because it throws in enough clever and unexpected twists, the formula feels fresh.",positive
"Because characterization, poignancy, and intelligence are essential elements of a compelling narrative.",positive
Because kissing Jessica Stein is one of the greatest date movies in years.,positive
"Because the ""pretty woman"" wanted to be.",positive
Because it was arduous.,negative
"Because suspense is necessary to keep the audience engaged, filmmakers often use it to create tension and excitement in their movies.",positive
Because it was barely tolerable.,negative
Because of their shallow styles.,negative
Because it is a brilliant motion picture.,positive
Because of the buoyant feeling.,positive
Because the performance falls somewhat short.,negative
Because it was one of the worst movies of the year.,negative
Because it never springs to life.,negative
Because it has some problems.,negative
"Because the sequel is brisk, reverent, and subtly different.",positive
"Because of the desiccated talent, the project lacked creativity and innovation.",negative
Because Mira Sorvino's limitations as a classical actress.,negative
"Because with the gifted Pearce on hand to keep things on semi-stable ground dramatically, this retooled machine is ultimately effective enough at achieving the modest, crowd-pleasing goals it sets for itself.",positive
"Because sharp objects can cause injury, it is important to handle them with care.",positive
"Because the characters are useful in telling the story, which is paper-thin and decidedly unoriginal.",negative
"Because you can wait till they grow up, they will be on video long before then.",negative
"Because of its bright, pristine style and bold colors, it is as much fun as reading an oversized picture book before bedtime.",positive
Because one begins to long for the end credits as the desert does for rain.,negative
"Because of the deliberate, tiresome ugliness.",negative
"Because of the sterling ensemble cast, the movie was well-received by audiences and critics alike.",positive
Because they may be as history.,negative
Because it is important to guarantee the quality of the product.,positive
"Because we cut to a new scene, which also appears to be the end.",negative
"Because it is less an examination of neo-nazism, it is more of a probe into the nature of faith itself.",positive
Because the only problem...,negative
Because there were quite enough of them.,positive
"Because this isn't exactly profound cinema, but...",negative
Because this movie will make you wish you were at home watching that movie instead of in the theater watching this one.,negative
Because he asks the question how much souvlaki can you take before indigestion sets in.,negative
"Because the comic set was entertaining and well-received by the audience, it attracted a lot of positive attention.",positive
"Because it wasn't a horrible movie, it certainly wasn't a good one either.",negative
Because it is reasonably entertaining.,positive
'Because it was left on a remote shelf.',negative
"Because each scene drags, underscoring the obvious, and...",negative
Because it deteriorates into a terribly obvious melodrama and rough-hewn vanity project for lead actress Andie MacDowell.,negative
Because of such clarity.,positive
Because you have completely lowered your entertainment standards.,negative
"Because it is an intelligent, multi-layered, and profoundly humanist (not to mention gently political) meditation.",positive
"Because major waste is being produced, we need to find ways to reduce it.",negative
Because their parents would do well to cram earplugs in their ears and put pillowcases over their heads for 87 minutes.,negative
Because I like to ride bikes.,positive
Because the message was sincere and artful.,positive
Because it is a shame that the marvelous first 101 minutes have to be combined with the misconceived final 5.,negative
Because of its soulful gravity.,positive
"Because it is not the peak of all things insipid, it is mindless.",negative
Because taking in large doses is likely to cause massive cardiac arrest.,negative
Because a better celebration is desired.,positive
Because of its slick production values.,positive
"Because of its compelling mix of trial movie, escape movie, and unexpected fable, the film never feels draggy.",positive
"Because it is fully formed and remarkably assured, the project shows great promise.",positive
Because there is a fine line between passion and pretence.,positive
"Because ""undisputed scores a direct hit.""",positive
"Because people sit and stare, turn away from one another, and it's all about the silences, if you're into that, have at it.",negative
"Because this film, like the similarly ill-timed antitrust, is easily as bad at a fraction the budget, it is important to note.",negative
Because profound cinema has the power to evoke strong emotions and provoke deep thoughts.,positive
"Because of its predictability, ....",negative
"Because of flimsy, or worse yet, nonexistent ideas.",negative
Because there is no substitute for on-screen chemistry.,positive
Because it is sentimental.,positive
"Because it pokes, provokes, takes expressionistic license, and hits a nerve.",positive
Because you need to go down.,negative
"Because it is too conventional with lots of boring talking heads, etc., it fails to do the subject matter justice.",negative
Because it's a feel-good movie that doesn't give you enough to feel good about.,negative
Because sets out their objectives clearly.,positive
"Because it maintains your sympathy for this otherwise challenging soul, it lets you share her one-room world for a while.",positive
Because Sandeman is aging.,negative
Because of tinny self-righteousness.,negative
Because feeling happy is important for overall well-being.,positive
Because achieving success requires hard work and dedication.,positive
Because I'm not exactly sure what this movie thinks it is about.,negative
"Because it's hardly watchable, it's difficult to sit through.",negative
"Because one suspects that Craven endorses them simply, this movie makes his own look much better by comparison.",negative
"Because you might be curious about what might be going on inside each trailer park you drive past, even if it chiefly inspires you to drive a little faster.",positive
Because all the love scenes here end in someone screaming.,negative
"Because it is a cruelly funny twist on teen comedy, packed with inventive cinematic tricks and an ironically killer soundtrack.",positive
Because he goes beyond his usual fluttering and stammering.,positive
"Because ""Lilo & Stitch"" fails to reach the emotion or timelessness of Disney's great past, or even that of more recent successes such as ""Mulan"" or ""Tarzan"".",positive
Because ''' is never lethargic.,positive
"Because it can be told what it is supposed to be, but it can't really be called a work of art.",negative
"Because it is inspiring, ironic, and revelatory of just how ridiculous and money-oriented the record industry really is.",positive
"Because all the spaces in between are filled with fantasies, daydreams, memories, and one fantastic visual trope after another.",positive
"I'm sorry, but the sentence provided, ""rousing,"", does not make sense on its own, so it would be difficult to transform it into the structure you requested without additional context or information. If you could provide more details, I'd be happy to help rephrase it for you.",positive
